{
  "event_id": "0190lt-0007",
  "timestamp": "2026-09-12T16:05:00Z",
  "kind": "legaltech.matter.privilege-log-entry-created",
  "source": "anchor-reef-mattermind-prod",
  "matter_ref": {
    "scheme": "matter-id-tokenized",
    "value": "tok_matter_AR2026_0042"
  },
  "resource": {
    "type": "privilege-log",
    "id_tokenized": "tok_resource_priv_e5",
    "privilege_tier": "work-product"
  },
  "action": "stamp",
  "outcome": {
    "status": "success",
    "recommendation": "no-recommendation"
  },
  "agent": {
    "ai_tool_card_url": "https://vendorl-mattermind.example/.well-known/ai-tool-cards/mattermind-4.x.json",
    "ai_decision_card_url": "https://anchor-reef.example/.well-known/decisions/AR-DEC-2026-MATTER-0042.json",
    "supervising_attorney_bar_id_tokenized": "tok_bar_4f9c2e",
    "supervising_attorney_jurisdiction": "NY",
    "session_principal_tokenized": "tok_principal_9a01"
  },
  "regulatory_basis": [
    "aba-rule-1-6",
    "work-product-doctrine-fed-r-civ-p-26-b-3"
  ],
  "conflict_check": {
    "passed_at": "2026-09-12T14:00:00Z",
    "engagement_letter_url": "https://anchor-reef.example/.well-known/engagement-letters/AR-ENG-2026-MATTER-0042.json",
    "conflicts_cleared": [
      "tok_party_op_xx12",
      "tok_party_op_yy44"
    ]
  },
  "decision_card_ref": "https://anchor-reef.example/.well-known/decisions/AR-DEC-2026-MATTER-0042.json",
  "prev_hash": "f4a6f7bae9821355a632f026377e9fe9f708dca3afd4c3e1ee1096febcbbfe07",
  "hash": "0441810093253ac512cff3b5c4d8b0015b77dfc2907eaf20d065f31e76e8dc64"
}
